code/email-marketing/scuole/distanze.json

{"G762": {"linea": 0.9, "strada": 1.1, "minuti": 2}, "L142": {"linea": 3.4, "strada": 4.3, "minuti": 8}, "H931": {"linea": 4.3, "strada": 5.5, "minuti": 9}, "I978": {"linea": 4.3, "strada": 5.0, "minuti": 6}, "B076": {"linea": 5.2, "strada": 5.9, "minuti": 8}, "I483": {"linea": 5.3, "strada": 7.0, "minuti": 11}, "I019": {"linea": 5.3, "strada": 6.5, "minuti": 10}, "I377": {"linea": 5.6, "strada": 9.2, "minuti": 15}, "G813": {"linea": 5.9, "strada": 7.2, "minuti": 10}, "B077": {"linea": 6.4, "strada": 7.8, "minuti": 10}, "G190": {"linea": 6.8, "strada": 9.4, "minuti": 13}, "H860": {"linea": 7.0, "strada": 10.9, "minuti": 14}, "A294": {"linea": 7.5, "strada": 11.6, "minuti": 14}, "I438": {"linea": 7.6, "strada": 9.8, "minuti": 12}, "G283": {"linea": 8.0, "strada": 10.2, "minuti": 13}, "L245": {"linea": 8.1, "strada": 9.4, "minuti": 14}, "I300": {"linea": 8.3, "strada": 11.5, "minuti": 14}, "M280": {"linea": 8.3, "strada": 10.3, "minuti": 15}, "M273": {"linea": 8.6, "strada": 11.2, "minuti": 16}, "G230": {"linea": 8.7, "strada": 13.6, "minuti": 14}, "I317": {"linea": 8.9, "strada": 13.4, "minuti": 15}, "B740": {"linea": 9.4, "strada": 14.6, "minuti": 20}, "C984": {"linea": 9.6, "strada": 15.6, "minuti": 16}, "E557": {"linea": 10.3, "strada": 14.7, "minuti": 23}, "D331": {"linea": 10.3, "strada": 15.5, "minuti": 21}, "F912": {"linea": 10.9, "strada": 16.5, "minuti": 17}, "B980": {"linea": 11.2, "strada": 17.1, "minuti": 22}, "I820": {"linea": 11.5, "strada": 14.7, "minuti": 19}, "E131": {"linea": 12.0, "strada": 16.9, "minuti": 21}, "H128": {"linea": 12.2, "strada": 23.4, "minuti": 32}, "C129": {"linea": 12.2, "strada": 15.0, "minuti": 21}, "I469": {"linea": 12.3, "strada": 15.2, "minuti": 21}, "E620": {"linea": 12.3, "strada": 17.7, "minuti": 22}, "E487": {"linea": 12.3, "strada": 20.4, "minuti": 28}, "E997": {"linea": 12.5, "strada": 19.4, "minuti": 24}, "G242": {"linea": 12.8, "strada": 21.4, "minuti": 26}, "L061": {"linea": 12.9, "strada": 20.9, "minuti": 29}, "I073": {"linea": 13.1, "strada": 15.8, "minuti": 20}, "I262": {"linea": 13.2, "strada": 17.8, "minuti": 23}, "F913": {"linea": 13.3, "strada": 19.0, "minuti": 20}, "I720": {"linea": 13.4, "strada": 25.5, "minuti": 29}, "F762": {"linea": 13.7, "strada": 23.9, "minuti": 32}, "I540": {"linea": 13.8, "strada": 19.8, "minuti": 24}, "F924": {"linea": 13.8, "strada": 17.1, "minuti": 21}, "L259": {"linea": 13.8, "strada": 18.7, "minuti": 23}, "G670": {"linea": 13.9, "strada": 23.5, "minuti": 28}, "H431": {"linea": 14.1, "strada": 21.1, "minuti": 25}, "C259": {"linea": 14.2, "strada": 22.2, "minuti": 24}, "G795": {"linea": 14.3, "strada": 21.6, "minuti": 27}, "M289": {"linea": 14.4, "strada": 24.6, "minuti": 28}, "H243": {"linea": 14.4, "strada": 19.3, "minuti": 22}, "I151": {"linea": 14.5, "strada": 23.9, "minuti": 27}, "L323": {"linea": 14.6, "strada": 30.4, "minuti": 45}, "M072": {"linea": 14.9, "strada": 30.7, "minuti": 32}, "B115": {"linea": 14.9, "strada": 21.5, "minuti": 30}, "B922": {"linea": 15.1, "strada": 18.8, "minuti": 25}, "I391": {"linea": 15.1, "strada": 22.0, "minuti": 22}, "E955": {"linea": 15.5, "strada": 23.9, "minuti": 25}, "C697": {"linea": 15.9, "strada": 22.9, "minuti": 24}, "C495": {"linea": 16.1, "strada": 21.8, "minuti": 26}, "G902": {"linea": 16.4, "strada": 22.0, "minuti": 26}, "B227": {"linea": 16.7, "strada": 22.6, "minuti": 28}, "E954": {"linea": 16.8, "strada": 26.6, "minuti": 28}, "C188": {"linea": 16.8, "strada": 21.1, "minuti": 25}, "H892": {"linea": 17.0, "strada": 26.4, "minuti": 29}, "I486": {"linea": 17.2, "strada": 36.9, "minuti": 51}, "C929": {"linea": 17.3, "strada": 26.1, "minuti": 28}, "G812": {"linea": 17.4, "strada": 22.9, "minuti": 28}, "B565": {"linea": 17.4, "strada": 25.4, "minuti": 27}, "L845": {"linea": 17.4, "strada": 25.9, "minuti": 32}, "L460": {"linea": 17.7, "strada": 27.2, "minuti": 27}, "A068": {"linea": 17.7, "strada": 31.4, "minuti": 37}, "H198": {"linea": 17.8, "strada": 35.5, "minuti": 49}, "F223": {"linea": 17.9, "strada": 45.1, "minuti": 45}, "C361": {"linea": 18.2, "strada": 24.7, "minuti": 26}, "M115": {"linea": 18.3, "strada": 25.5, "minuti": 28}, "I893": {"linea": 18.3, "strada": 29.5, "minuti": 28}, "F798": {"linea": 18.4, "strada": 30.6, "minuti": 29}, "D701": {"linea": 18.6, "strada": 39.1, "minuti": 37}, "F506": {"linea": 18.6, "strada": 39.9, "minuti": 44}, "C675": {"linea": 18.6, "strada": 26.5, "minuti": 28}, "A580": {"linea": 18.7, "strada": 30.6, "minuti": 29}, "E839": {"linea": 18.9, "strada": 43.4, "minuti": 43}, "A508": {"linea": 18.9, "strada": 30.3, "minuti": 31}, "H097": {"linea": 18.9, "strada": 31.0, "minuti": 30}, "F138": {"linea": 18.9, "strada": 25.9, "minuti": 23}, "A487": {"linea": 18.9, "strada": 48.4, "minuti": 48}, "I756": {"linea": 19.1, "strada": 30.6, "minuti": 29}, "G932": {"linea": 19.1, "strada": 43.2, "minuti": 56}, "A251": {"linea": 19.1, "strada": 48.6, "minuti": 48}, "B905": {"linea": 19.3, "strada": 32.4, "minuti": 33}, "M330": {"linea": 19.4, "strada": 30.8, "minuti": 28}, "H433": {"linea": 19.5, "strada": 28.5, "minuti": 31}, "D826": {"linea": 19.9, "strada": 38.0, "minuti": 43}, "F162": {"linea": 20.0, "strada": 29.3, "minuti": 40}, "C940": {"linea": 20.3, "strada": 42.1, "minuti": 49}, "G426": {"linea": 20.6, "strada": 33.5, "minuti": 33}, "G976": {"linea": 20.7, "strada": 58.4, "minuti": 61}, "A674": {"linea": 20.8, "strada": 30.3, "minuti": 27}, "G568": {"linea": 20.9, "strada": 30.3, "minuti": 41}, "A024": {"linea": 21.1, "strada": 27.5, "minuti": 31}, "L860": {"linea": 21.7, "strada": 29.0, "minuti": 31}, "I208": {"linea": 21.8, "strada": 31.5, "minuti": 44}, "C584": {"linea": 21.8, "strada": 33.6, "minuti": 34}, "C971": {"linea": 22.0, "strada": 39.8, "minuti": 38}, "F141": {"linea": 22.1, "strada": 46.8, "minuti": 45}, "D615": {"linea": 22.7, "strada": 29.8, "minuti": 27}, "H703": {"linea": 23.2, "strada": 32.8, "minuti": 34}, "I862": {"linea": 23.3, "strada": 33.8, "minuti": 48}, "A064": {"linea": 23.4, "strada": 34.4, "minuti": 37}, "B990": {"linea": 23.6, "strada": 31.7, "minuti": 34}, "G165": {"linea": 23.8, "strada": 50.0, "minuti": 52}, "F839": {"linea": 24.2, "strada": 31.3, "minuti": 34}, "B946": {"linea": 24.3, "strada": 33.1, "minuti": 33}, "H834": {"linea": 24.3, "strada": 36.4, "minuti": 41}, "L004": {"linea": 24.7, "strada": 50.9, "minuti": 53}}

docs/procedure/sito-web-wordpress.md

## 12.0 GDPR

- [ ] 12.1 Installazione plugin: CookieYes
- [ ] 12.2 Impostazione barra dei cookie
- [ ] 12.3 Documenti cookie policy e privacy policy
- [ ] 12.4 Aggiunta spunte di accettazione su moduli contatto + newsletter

## 13.0 User testing e pubblicazione

- [ ] 13.1 Pubblicare il sito web (disattivare modalità manutenzione)
- [ ] 13.2 Test indicizzazione su Google (`site:www.tuosito.com`)
- [ ] 13.3 Test di tutti i link e pulsanti su tutte le pagine
- [ ] 13.4 Test di tutti i moduli (contatti, newsletter ecc.)
- [ ] 13.5 Test design responsive dai dispositivi mobili
- [ ] 13.6 Elimina le risorse inutili tramite plugin: Asset Clean Up

## 14.0 Consegna dei lavori

- [ ] 14.1 Incontro/call di consegna sito
- [ ] 14.2 Mail con recap dei termini della collaborazione
- [ ] 14.3 Bonifico di saldo ricevuto